{
  "$schema": "../schemas/design-document-registry-v3.schema.json",
  "schema_version": 3,
  "registry_role": "ai-design-document-router-and-publication-index",
  "project_name": "십보강호: 숨은 수의 비무",
  "source_of_truth_policy": "Each question has exactly one Markdown or JSON source of truth. Active sources describe the current contract; history lives in Git, Change Log, and Learning Log.",
  "publication_note": "Current repository operation is source_only because no publication generator is installed. Promote selected documents to milestone_sync only when generator, fonts, rendering, manifest, and review are installed together.",
  "required_responsibility_coverage": ["프로젝트 전체", "게임 디자인", "UX·UI·접근성", "개발·엔지니어링", "QA", "프로덕션·PM", "통합검수"],
  "available_responsibility_catalog": ["설정·내러티브", "게임 디자인", "UX·UI·접근성", "개발·엔지니어링", "테크니컬 아트·파이프라인", "아트", "사운드", "QA", "프로덕션·PM", "분석·유저리서치", "통합검수"],
  "documents": [
    {
      "document_id": "project-ai-production-spec",
      "title": "PROJECT AI PRODUCTION SPEC — 십보강호",
      "discipline": "통합검수",
      "responsibility_coverage": ["프로젝트 전체", "게임 디자인", "UX·UI·접근성", "개발·엔지니어링", "QA", "프로덕션·PM", "통합검수"],
      "status": "ACTIVE",
      "source_path": "../docs/design/PROJECT_AI_PRODUCTION_SPEC.md",
      "source_format": "markdown",
      "source_role": "narrative_spec",
      "publication_policy": "source_only",
      "output_pdf": null,
      "output_docx": null,
      "asset_dir": null,
      "diagram_policy": "none",
      "publication_manifest": null,
      "generator": null,
      "required_sections": ["CANON SNAPSHOT", "SOURCE REGISTRY", "CURRENT PROJECT STATE", "PLAYER EXPERIENCE CONTRACT", "SYSTEM REGISTRY", "UI/UX AND INPUT CONTRACT", "TECHNICAL ARCHITECTURE", "TEST AND QA CONTRACT", "RISKS AND BLOCKERS", "IMPLEMENTATION QUEUE", "CHANGE LOG"]
    },
    {
      "document_id": "project-game-design",
      "title": "십보강호 게임 기획서",
      "discipline": "게임 디자인",
      "responsibility_coverage": ["프로젝트 전체", "게임 디자인"],
      "status": "ACTIVE",
      "source_path": "../docs/01_GAME_DESIGN.md",
      "source_format": "markdown",
      "source_role": "narrative_spec",
      "publication_policy": "source_only",
      "output_pdf": null,
      "output_docx": null,
      "asset_dir": null,
      "diagram_policy": "none",
      "publication_manifest": null,
      "generator": null,
      "required_sections": ["현재 한 줄 약속", "현재 핵심 경험 가설", "설계 원칙", "제품 범위", "프로젝트 성공 조건", "현재 검수 게이트"]
    },
    {
      "document_id": "combat-rules",
      "title": "십보강호 전투 규칙서",
      "discipline": "게임 디자인",
      "responsibility_coverage": ["게임 디자인"],
      "status": "ACTIVE",
      "source_path": "../docs/02_COMBAT_RULES.md",
      "source_format": "markdown",
      "source_role": "narrative_spec",
      "publication_policy": "source_only",
      "output_pdf": null,
      "output_docx": null,
      "asset_dir": null,
      "diagram_policy": "none",
      "publication_manifest": null,
      "generator": null,
      "required_sections": ["전장과 거리", "라운드와 계획 확정", "판정 파이프라인", "`[합]`·연격·방어·회피·`[필중]`", "태세·중단·`[강건]`", "공개 상태 기반 라이벌 후보 AI", "전투 종료와 재시작", "T0 검증 기준"]
    },
    {
      "document_id": "content-catalog",
      "title": "십보강호 콘텐츠 카탈로그",
      "discipline": "게임 디자인",
      "responsibility_coverage": ["게임 디자인"],
      "status": "ACTIVE",
      "source_path": "../docs/03_CONTENT_CATALOG.md",
      "source_format": "markdown",
      "source_role": "narrative_spec",
      "publication_policy": "source_only",
      "output_pdf": null,
      "output_docx": null,
      "asset_dir": null,
      "diagram_policy": "none",
      "publication_manifest": null,
      "generator": null,
      "required_sections": ["상태 구분", "CURRENT_T0", "PLANNED_T1", "HYPOTHESIS_T2_PLUS", "HOLD", "콘텐츠 추가 게이트"]
    },
    {
      "document_id": "product-roadmap",
      "title": "십보강호 구현 로드맵과 검증 기준",
      "discipline": "프로덕션·PM",
      "responsibility_coverage": ["프로덕션·PM", "통합검수"],
      "status": "ACTIVE",
      "source_path": "../docs/04_ROADMAP.md",
      "source_format": "markdown",
      "source_role": "narrative_spec",
      "publication_policy": "source_only",
      "output_pdf": null,
      "output_docx": null,
      "asset_dir": null,
      "diagram_policy": "none",
      "publication_manifest": null,
      "generator": null,
      "required_sections": ["현재 단계", "현재 작업", "프로젝트 코어 확정", "STEP 14", "T1", "공통 검증 게이트", "중단·축소 조건"]
    },
    {
      "document_id": "combat-vertical-slice",
      "title": "십보강호 전투 POC·세로 슬라이스 명세",
      "discipline": "게임 디자인",
      "responsibility_coverage": ["게임 디자인", "프로덕션·PM", "통합검수"],
      "status": "ACTIVE",
      "source_path": "../docs/05_COMBAT_POC_SPEC.md",
      "source_format": "markdown",
      "source_role": "narrative_spec",
      "publication_policy": "source_only",
      "output_pdf": null,
      "output_docx": null,
      "asset_dir": null,
      "diagram_policy": "none",
      "publication_manifest": null,
      "generator": null,
      "required_sections": ["목적", "단계 구분", "현행 T0 계약", "구현 단계와 증거 상태", "STEP 14 플레이테스트 계약", "T0 완료 기준", "현재 판정"]
    },
    {
      "document_id": "mastery-data",
      "title": "십보강호 세력·핵심무공·심법 성장 가설",
      "discipline": "게임 디자인",
      "responsibility_coverage": ["게임 디자인", "개발·엔지니어링"],
      "status": "ACTIVE",
      "source_path": "../docs/06_STARTING_FACTION_MASTERY_DATA.md",
      "source_format": "markdown",
      "source_role": "narrative_spec",
      "publication_policy": "source_only",
      "output_pdf": null,
      "output_docx": null,
      "asset_dir": null,
      "diagram_policy": "none",
      "publication_manifest": null,
      "generator": null,
      "required_sections": ["현재 상태", "현행 전투 계약과 연결 원칙", "다음 PoC 성장 실험", "장기 보유 구조 가설", "세력 정체성 후보", "기본 절초·10성 절초·진의", "성장 진입 게이트", "검증 기준"]
    },
    {
      "document_id": "combat-ui-spec",
      "title": "십보강호 전투 UI·아트 명세",
      "discipline": "UX·UI·접근성",
      "responsibility_coverage": ["UX·UI·접근성", "아트"],
      "status": "ACTIVE",
      "source_path": "../docs/07_COMBAT_UI_SPEC.md",
      "source_format": "markdown",
      "source_role": "narrative_spec",
      "publication_policy": "source_only",
      "output_pdf": null,
      "output_docx": null,
      "asset_dir": null,
      "diagram_policy": "none",
      "publication_manifest": null,
      "generator": null,
      "required_sections": ["UI 목표", "화면 구조", "시각 자산", "상단 HUD", "행동 슬롯", "합·대응·중단 결과 UI", "입력·접근성", "현재 검증 상태"]
    },
    {
      "document_id": "qa-test-checklist",
      "title": "십보강호 테스트 체크리스트",
      "discipline": "QA",
      "responsibility_coverage": ["QA", "통합검수"],
      "status": "ACTIVE",
      "source_path": "../docs/08_TEST_CHECKLIST.md",
      "source_format": "markdown",
      "source_role": "narrative_spec",
      "publication_policy": "source_only",
      "output_pdf": null,
      "output_docx": null,
      "asset_dir": null,
      "diagram_policy": "none",
      "publication_manifest": null,
      "generator": null,
      "required_sections": ["판정 상태", "현재 증거 요약", "전장·점유·대상", "합·방어·회피·필중", "AI", "종료·재시작", "STEP 14 사람 플레이", "T1 진입 게이트", "종료 보고"]
    },
    {
      "document_id": "combat-system-architecture",
      "title": "십보강호 전투 시스템 아키텍처",
      "discipline": "개발·엔지니어링",
      "responsibility_coverage": ["개발·엔지니어링"],
      "status": "ACTIVE",
      "source_path": "../docs/09_COMBAT_SYSTEM_ARCHITECTURE.md",
      "source_format": "markdown",
      "source_role": "narrative_spec",
      "publication_policy": "source_only",
      "output_pdf": null,
      "output_docx": null,
      "asset_dir": null,
      "diagram_policy": "none",
      "publication_manifest": null,
      "generator": null,
      "required_sections": ["아키텍처 원칙", "실제 파일 책임", "현재 `CombatState`", "공개 상태 라이벌 후보 AI 경계", "묶음 판정과 반환 구조", "순차 표현 상태", "종료·재시작", "검증 경계"]
    },
    {
      "document_id": "combat-presentation-plan",
      "title": "십보강호 전투 연출 기획서",
      "discipline": "UX·UI·접근성",
      "responsibility_coverage": ["UX·UI·접근성", "아트", "사운드"],
      "status": "ACTIVE",
      "source_path": "../docs/10_COMBAT_PRESENTATION_PLAN.md",
      "source_format": "markdown",
      "source_role": "narrative_spec",
      "publication_policy": "source_only",
      "output_pdf": null,
      "output_docx": null,
      "asset_dir": null,
      "diagram_policy": "none",
      "publication_manifest": null,
      "generator": null,
      "required_sections": ["연출 목표", "첫 시선", "현재 전투 흐름", "수별 판정 표현", "합 연출", "중단·강건 연출", "절초 연출", "종료·재시작 연출", "접근성 폴백", "현재 상태"]
    },
    {
      "document_id": "base-adoption-learning",
      "title": "십보강호 Base 적용·학습 순환 기록",
      "discipline": "통합검수",
      "responsibility_coverage": ["프로덕션·PM", "통합검수"],
      "status": "ACTIVE",
      "source_path": "../docs/11_BASE_ADOPTION_AND_LEARNING_LOG.md",
      "source_format": "markdown",
      "source_role": "narrative_spec",
      "publication_policy": "source_only",
      "output_pdf": null,
      "output_docx": null,
      "asset_dir": null,
      "diagram_policy": "none",
      "publication_manifest": null,
      "generator": null,
      "required_sections": ["기준 정보", "이번 Base 변화", "프로젝트 적용 구조", "정본 최신화에서 발견한 문제", "프로젝트 고유 계약", "공용화 가능한 관찰", "검증 상태", "후속 리뷰 조건"]
    }
  ]
}
